{
  "version": 1,
  "pair_id": "drone",
  "house": "technologia",
  "raw_ref": "raw_drone.vtt",
  "published_ref": "zft8kUVW3KU",
  "window_s": 15.0,
  "alignment": {
    "published_windows": 321,
    "matched_windows": 321,
    "coverage": 1.0
  },
  "segments": [
    {
      "action": "cut",
      "raw_span": [
        0.0,
        960.0
      ],
      "scope": "pre_show"
    },
    {
      "action": "keep",
      "raw_span": [
        960.0,
        1035.0
      ],
      "published_span": [
        0.0,
        60.0
      ],
      "speed": 1.25,
      "confidence": 0.656
    },
    {
      "action": "keep",
      "raw_span": [
        1020.0,
        1095.0
      ],
      "published_span": [
        60.0,
        135.0
      ],
      "speed": 1.0,
      "confidence": 0.775
    },
    {
      "action": "keep",
      "raw_span": [
        1080.0,
        1500.0
      ],
      "published_span": [
        135.0,
        525.0
      ],
      "speed": 1.0,
      "confidence": 0.784
    },
    {
      "action": "keep",
      "raw_span": [
        1485.0,
        1500.0
      ],
      "published_span": [
        525.0,
        540.0
      ],
      "speed": 1.0,
      "confidence": 0.715
    },
    {
      "action": "keep",
      "raw_span": [
        1485.0,
        1575.0
      ],
      "published_span": [
        540.0,
        615.0
      ],
      "speed": 1.2,
      "confidence": 0.808
    },
    {
      "action": "keep",
      "raw_span": [
        1560.0,
        1695.0
      ],
      "published_span": [
        615.0,
        735.0
      ],
      "speed": 1.0,
      "confidence": 0.75
    },
    {
      "action": "keep",
      "raw_span": [
        1680.0,
        2100.0
      ],
      "published_span": [
        735.0,
        1125.0
      ],
      "speed": 1.0,
      "confidence": 0.818
    },
    {
      "action": "keep",
      "raw_span": [
        2085.0,
        2175.0
      ],
      "published_span": [
        1125.0,
        1200.0
      ],
      "speed": 1.2,
      "confidence": 0.803
    },
    {
      "action": "keep",
      "raw_span": [
        2160.0,
        2220.0
      ],
      "published_span": [
        1200.0,
        1245.0
      ],
      "speed": 1.33,
      "confidence": 0.753
    },
    {
      "action": "keep",
      "raw_span": [
        2205.0,
        2370.0
      ],
      "published_span": [
        1245.0,
        1395.0
      ],
      "speed": 1.0,
      "confidence": 0.789
    },
    {
      "action": "keep",
      "raw_span": [
        2355.0,
        2505.0
      ],
      "published_span": [
        1395.0,
        1530.0
      ],
      "speed": 1.0,
      "confidence": 0.719
    },
    {
      "action": "keep",
      "raw_span": [
        2490.0,
        2685.0
      ],
      "published_span": [
        1530.0,
        1710.0
      ],
      "speed": 1.0,
      "confidence": 0.795
    },
    {
      "action": "keep",
      "raw_span": [
        2670.0,
        2775.0
      ],
      "published_span": [
        1710.0,
        1800.0
      ],
      "speed": 1.0,
      "confidence": 0.821
    },
    {
      "action": "keep",
      "raw_span": [
        2760.0,
        2820.0
      ],
      "published_span": [
        1800.0,
        1845.0
      ],
      "speed": 1.33,
      "confidence": 0.726
    },
    {
      "action": "keep",
      "raw_span": [
        2805.0,
        2985.0
      ],
      "published_span": [
        1845.0,
        2010.0
      ],
      "speed": 1.0,
      "confidence": 0.764
    },
    {
      "action": "keep",
      "raw_span": [
        2970.0,
        3045.0
      ],
      "published_span": [
        2010.0,
        2070.0
      ],
      "speed": 1.25,
      "confidence": 0.786
    },
    {
      "action": "keep",
      "raw_span": [
        3030.0,
        3120.0
      ],
      "published_span": [
        2070.0,
        2145.0
      ],
      "speed": 1.2,
      "confidence": 0.696
    },
    {
      "action": "keep",
      "raw_span": [
        3105.0,
        3225.0
      ],
      "published_span": [
        2145.0,
        2250.0
      ],
      "speed": 1.0,
      "confidence": 0.796
    },
    {
      "action": "keep",
      "raw_span": [
        3210.0,
        3300.0
      ],
      "published_span": [
        2250.0,
        2325.0
      ],
      "speed": 1.2,
      "confidence": 0.712
    },
    {
      "action": "keep",
      "raw_span": [
        3285.0,
        3495.0
      ],
      "published_span": [
        2325.0,
        2520.0
      ],
      "speed": 1.0,
      "confidence": 0.784
    },
    {
      "action": "keep",
      "raw_span": [
        3480.0,
        3630.0
      ],
      "published_span": [
        2520.0,
        2655.0
      ],
      "speed": 1.0,
      "confidence": 0.715
    },
    {
      "action": "keep",
      "raw_span": [
        3615.0,
        3930.0
      ],
      "published_span": [
        2655.0,
        2955.0
      ],
      "speed": 1.0,
      "confidence": 0.851
    },
    {
      "action": "keep",
      "raw_span": [
        3915.0,
        4005.0
      ],
      "published_span": [
        2955.0,
        3030.0
      ],
      "speed": 1.2,
      "confidence": 0.732
    },
    {
      "action": "keep",
      "raw_span": [
        3990.0,
        4065.0
      ],
      "published_span": [
        3030.0,
        3090.0
      ],
      "speed": 1.25,
      "confidence": 0.722
    },
    {
      "action": "keep",
      "raw_span": [
        4050.0,
        4080.0
      ],
      "published_span": [
        3090.0,
        3120.0
      ],
      "speed": 1.0,
      "confidence": 0.709
    },
    {
      "action": "cut",
      "raw_span": [
        4080.0,
        4425.0
      ],
      "scope": "in_show"
    },
    {
      "action": "keep",
      "raw_span": [
        4425.0,
        5130.0
      ],
      "published_span": [
        3120.0,
        3780.0
      ],
      "speed": 1.0,
      "confidence": 0.821
    },
    {
      "action": "keep",
      "raw_span": [
        5115.0,
        5160.0
      ],
      "published_span": [
        3780.0,
        3810.0
      ],
      "speed": 1.5,
      "confidence": 0.682
    },
    {
      "action": "keep",
      "raw_span": [
        5145.0,
        5340.0
      ],
      "published_span": [
        3810.0,
        3990.0
      ],
      "speed": 1.0,
      "confidence": 0.699
    },
    {
      "action": "keep",
      "raw_span": [
        5325.0,
        5415.0
      ],
      "published_span": [
        3990.0,
        4065.0
      ],
      "speed": 1.2,
      "confidence": 0.605
    },
    {
      "action": "keep",
      "raw_span": [
        5400.0,
        5505.0
      ],
      "published_span": [
        4065.0,
        4155.0
      ],
      "speed": 1.0,
      "confidence": 0.765
    },
    {
      "action": "keep",
      "raw_span": [
        5490.0,
        5550.0
      ],
      "published_span": [
        4155.0,
        4200.0
      ],
      "speed": 1.33,
      "confidence": 0.745
    },
    {
      "action": "keep",
      "raw_span": [
        5535.0,
        5580.0
      ],
      "published_span": [
        4200.0,
        4230.0
      ],
      "speed": 1.5,
      "confidence": 0.449
    },
    {
      "action": "keep",
      "raw_span": [
        5565.0,
        5610.0
      ],
      "published_span": [
        4230.0,
        4260.0
      ],
      "speed": 1.5,
      "confidence": 0.794
    },
    {
      "action": "keep",
      "raw_span": [
        5595.0,
        5745.0
      ],
      "published_span": [
        4260.0,
        4395.0
      ],
      "speed": 1.0,
      "confidence": 0.688
    },
    {
      "action": "keep",
      "raw_span": [
        5730.0,
        5865.0
      ],
      "published_span": [
        4395.0,
        4515.0
      ],
      "speed": 1.0,
      "confidence": 0.657
    },
    {
      "action": "keep",
      "raw_span": [
        5850.0,
        5955.0
      ],
      "published_span": [
        4515.0,
        4605.0
      ],
      "speed": 1.0,
      "confidence": 0.756
    },
    {
      "action": "keep",
      "raw_span": [
        5940.0,
        6015.0
      ],
      "published_span": [
        4605.0,
        4665.0
      ],
      "speed": 1.25,
      "confidence": 0.776
    },
    {
      "action": "keep",
      "raw_span": [
        6000.0,
        6075.0
      ],
      "published_span": [
        4665.0,
        4725.0
      ],
      "speed": 1.25,
      "confidence": 0.633
    },
    {
      "action": "keep",
      "raw_span": [
        6060.0,
        6090.0
      ],
      "published_span": [
        4725.0,
        4755.0
      ],
      "speed": 1.0,
      "confidence": 0.743
    },
    {
      "action": "keep",
      "raw_span": [
        6075.0,
        6165.0
      ],
      "published_span": [
        4755.0,
        4815.0
      ],
      "speed": 1.5,
      "confidence": 0.672
    },
    {
      "action": "cut",
      "raw_span": [
        6165.0,
        6765.0
      ],
      "scope": "post_show"
    }
  ]
}
